{
  "date": "2026-09-14",
  "number": 1,
  "locale": "es-ES",
  "region": "ES",
  "sections": [
    {
      "key": "portada",
      "name": "Portada",
      "articles": [
        {
          "slug": "el-gobierno-aprueba-la-reforma-de-la-ley-de-vivienda",
          "headline": "El Gobierno aprueba la reforma de la ley de vivienda",
          "subhead": "Cobertura de 3 fuentes",
          "dateline": "MADRID",
          "body": [
            "El Gobierno aprueba la reforma de la ley de vivienda. Así lo recogen este lunes El País, RTVE y elDiario.es, según las piezas consultadas por Linotipo.",
            "El País titula «El Gobierno aprueba la reforma de la ley de vivienda». Otros medios coinciden en lo esencial: RTVE habla de «El Consejo de Ministros aprueba la reforma de la ley de vivienda»; elDiario.es habla de «Claves de la reforma de la ley de vivienda aprobada por el Gobierno».",
            "Este artículo ha sido generado con un modelo de prueba sin acceso al texto completo de las fuentes; el contenido se limita a lo que indican sus titulares. Consulte las fuentes citadas al pie para el detalle."
          ],
          "citations": [
            {
              "source_id": "db5cef690827",
              "quote": "El Gobierno aprueba la reforma de la ley de vivienda"
            },
            {
              "source_id": "baf757820e80",
              "quote": null
            },
            {
              "source_id": "2b1638d44502",
              "quote": null
            }
          ],
          "topics": [
            "el",
            "gobierno"
          ],
          "lead": true
        }
      ]
    },
    {
      "key": "espana",
      "name": "España",
      "articles": [
        {
          "slug": "el-banco-de-espana-mejora-la-prevision-de-crecimiento-al-2-4",
          "headline": "El Banco de España mejora la previsión de crecimiento al 2,4%",
          "subhead": "Cobertura de 2 fuentes",
          "dateline": "MADRID",
          "body": [
            "El Banco de España mejora la previsión de crecimiento al 2,4%. Así lo recogen este lunes El Mundo y Expansión, según las piezas consultadas por Linotipo.",
            "El Mundo titula «El Banco de España mejora la previsión de crecimiento al 2,4%». Otros medios coinciden en lo esencial: Expansión habla de «El Banco de España eleva su previsión de crecimiento para este año».",
            "Este artículo ha sido generado con un modelo de prueba sin acceso al texto completo de las fuentes; el contenido se limita a lo que indican sus titulares. Consulte las fuentes citadas al pie para el detalle."
          ],
          "citations": [
            {
              "source_id": "42e460afe8ac",
              "quote": "El Banco de España mejora la previsión de crecimiento al 2,4%"
            },
            {
              "source_id": "6f37bd3a98c5",
              "quote": null
            }
          ],
          "topics": [
            "el",
            "banco"
          ],
          "lead": true
        },
        {
          "slug": "la-huelga-de-transporte-afecta-a-los-principales-puertos",
          "headline": "La huelga de transporte afecta a los principales puertos",
          "subhead": "Cobertura de 1 fuente",
          "dateline": "MADRID",
          "body": [
            "La huelga de transporte afecta a los principales puertos. Así lo recogen este lunes El Mundo, según las piezas consultadas por Linotipo.",
            "El Mundo titula «La huelga de transporte afecta a los principales puertos». Por ahora es el único medio que recoge la noticia.",
            "Este artículo ha sido generado con un modelo de prueba sin acceso al texto completo de las fuentes; el contenido se limita a lo que indican sus titulares. Consulte las fuentes citadas al pie para el detalle."
          ],
          "citations": [
            {
              "source_id": "511afbc536d2",
              "quote": "La huelga de transporte afecta a los principales puertos"
            }
          ],
          "topics": [
            "la",
            "huelga"
          ],
          "lead": false
        }
      ]
    },
    {
      "key": "internacional",
      "name": "Internacional",
      "articles": [
        {
          "slug": "el-csic-descubre-una-nueva-especie-de-anfibio-en-los-pirineos",
          "headline": "El CSIC descubre una nueva especie de anfibio en los Pirineos",
          "subhead": "Cobertura de 2 fuentes",
          "dateline": "MADRID",
          "body": [
            "El CSIC descubre una nueva especie de anfibio en los Pirineos. Así lo recogen este lunes 20minutos y El País, según las piezas consultadas por Linotipo.",
            "El País titula «El CSIC descubre una nueva especie de anfibio en los Pirineos». Otros medios coinciden en lo esencial: 20minutos habla de «Investigadores del CSIC hallan una nueva especie de anfibio».",
            "Este artículo ha sido generado con un modelo de prueba sin acceso al texto completo de las fuentes; el contenido se limita a lo que indican sus titulares. Consulte las fuentes citadas al pie para el detalle."
          ],
          "citations": [
            {
              "source_id": "d26c524b5b8d",
              "quote": "El CSIC descubre una nueva especie de anfibio en los Pirineos"
            },
            {
              "source_id": "95026ab398c3",
              "quote": null
            }
          ],
          "topics": [
            "el",
            "csic"
          ],
          "lead": true
        },
        {
          "slug": "sanidad-amplia-el-calendario-de-vacunacion-infantil",
          "headline": "Sanidad amplía el calendario de vacunación infantil",
          "subhead": "Cobertura de 1 fuente",
          "dateline": "MADRID",
          "body": [
            "Sanidad amplía el calendario de vacunación infantil. Así lo recogen este lunes elDiario.es, según las piezas consultadas por Linotipo.",
            "elDiario.es titula «Sanidad amplía el calendario de vacunación infantil». Por ahora es el único medio que recoge la noticia.",
            "Este artículo ha sido generado con un modelo de prueba sin acceso al texto completo de las fuentes; el contenido se limita a lo que indican sus titulares. Consulte las fuentes citadas al pie para el detalle."
          ],
          "citations": [
            {
              "source_id": "2ebac4291027",
              "quote": "Sanidad amplía el calendario de vacunación infantil"
            }
          ],
          "topics": [
            "sanidad",
            "amplía"
          ],
          "lead": false
        }
      ]
    },
    {
      "key": "economia",
      "name": "Economía",
      "articles": [
        {
          "slug": "el-prado-inaugura-una-gran-retrospectiva-de-sorolla",
          "headline": "El Prado inaugura una gran retrospectiva de Sorolla",
          "subhead": "Cobertura de 2 fuentes",
          "dateline": "MADRID",
          "body": [
            "El Prado inaugura una gran retrospectiva de Sorolla. Así lo recogen este lunes RTVE y elDiario.es, según las piezas consultadas por Linotipo.",
            "elDiario.es titula «El Prado inaugura una gran retrospectiva de Sorolla». Otros medios coinciden en lo esencial: RTVE habla de «El Museo del Prado abre la retrospectiva de Sorolla».",
            "Este artículo ha sido generado con un modelo de prueba sin acceso al texto completo de las fuentes; el contenido se limita a lo que indican sus titulares. Consulte las fuentes citadas al pie para el detalle."
          ],
          "citations": [
            {
              "source_id": "6fc1f8b06cf6",
              "quote": "El Prado inaugura una gran retrospectiva de Sorolla"
            },
            {
              "source_id": "119b674d8f23",
              "quote": null
            }
          ],
          "topics": [
            "el",
            "prado"
          ],
          "lead": true
        }
      ]
    },
    {
      "key": "sociedad",
      "name": "Sociedad",
      "articles": [
        {
          "slug": "el-real-madrid-gana-en-el-ultimo-minuto-y-lidera-la-clasificacion",
          "headline": "El Real Madrid gana en el último minuto y lidera la clasificación",
          "subhead": "Cobertura de 2 fuentes",
          "dateline": "MADRID",
          "body": [
            "El Real Madrid gana en el último minuto y lidera la clasificación. Así lo recogen este lunes El Mundo y Marca, según las piezas consultadas por Linotipo.",
            "El Mundo titula «El Real Madrid gana en el último minuto y lidera la clasificación». Otros medios coinciden en lo esencial: Marca habla de «El Real Madrid gana en el descuento y se pone líder».",
            "Este artículo ha sido generado con un modelo de prueba sin acceso al texto completo de las fuentes; el contenido se limita a lo que indican sus titulares. Consulte las fuentes citadas al pie para el detalle."
          ],
          "citations": [
            {
              "source_id": "6c6f6679de29",
              "quote": "El Real Madrid gana en el último minuto y lidera la clasificación"
            },
            {
              "source_id": "cf708afef4b7",
              "quote": null
            }
          ],
          "topics": [
            "el",
            "real"
          ],
          "lead": true
        }
      ]
    },
    {
      "key": "cultura",
      "name": "Cultura",
      "articles": [
        {
          "slug": "la-comision-europea-propone-un-nuevo-paquete-de-sanciones",
          "headline": "La Comisión Europea propone un nuevo paquete de sanciones",
          "subhead": "Cobertura de 2 fuentes",
          "dateline": "MADRID",
          "body": [
            "La Comisión Europea propone un nuevo paquete de sanciones. Así lo recogen este lunes El País y RTVE, según las piezas consultadas por Linotipo.",